Week,Day,Start,End,Duration(hrs),Task,Subtasks
1,Day 1,10:00,13:30,3.5,GitHub & Project Scaffolding,"Install Node/Git; Scaffold Vite TS; Add Tailwind/deps; Push to GitHub; README"
1,Day 2,10:00,13:30,3.5,Cloudflare Pages + Cognito,"Connect repo; Build settings; Env vars; Create User Pool + App Client; Hosted UI; Test login"
1,Day 3,10:00,14:00,4,Backend (SAM, API GW, S3, JWT),"ACM cert; SAM deploy; Verify endpoints; Auth test 401→200"
1,Day 4,10:00,13:30,3.5,Wire Frontend ↔ Backend,"Set VITE_API_BASE; Deploy; E2E test; Add CI; Docs"
2+,Block A,10:00,13:00,3,S3 History & Pagination,"Per-user prefixes; summaries; list view"
2+,Block B,10:00,13:00,3,Charts & Exports,"Bar/compare; CSV/PDF"
2+,Block C,10:00,13:00,3,Docs & Testing,"Setup guide; sample cases; tests"
